{
  "key": "dark",
  "label": "Dark",
  "ui": {
    "pageBackground": "#0b1220",
    "pageText": "#e5e7eb",
    "cardBackground": "#0f172a",
    "cardShadow": "0 12px 32px rgba(2, 6, 23, 0.45)",
    "buttonBackground": "#111827",
    "buttonText": "#e5e7eb",
    "buttonBorder": "#334155"
  },
  "spec": {
    "background": "#0f172a",
    "config": {
      "font": "Helvetica, Arial, sans-serif",
      "view": { "stroke": null },
      "axis": {
        "domain": false,
        "gridColor": "#334155",
        "gridDash": [5, 5],
        "labelFontSize": 14,
        "titleFontSize": 15,
        "labelFont": "Helvetica, Arial, sans-serif",
        "titleFont": "Helvetica, Arial, sans-serif",
        "labelColor": "#cbd5e1",
        "titleColor": "#e5e7eb"
      },
      "text": {
        "fontSize": 13,
        "font": "Helvetica, Arial, sans-serif",
        "color": "#e5e7eb"
      }
    },
    "layer": [
      {
        "mark": {
          "color": "#60a5fa",
          "fillOpacity": 0.25,
          "stroke": "#60a5fa",
          "strokeOpacity": 1,
          "strokeWidth": 2
        }
      },
      {
        "mark": {
          "color": "#e5e7eb"
        }
      }
    ],
    "encoding": {
      "x": {
        "axis": {
          "grid": true,
          "gridColor": "#334155",
          "gridDash": [5, 5]
        }
      }
    }
  }
}
